,hotel_name,review,rating
297,Hanoi Marigold Hotel,"(Translated by Google) The hotel is walking distance, convenient to travel, a staff of young and enthusiastic, convenient to the whole association …",5/5
298,Nhà nghỉ Năm Thanh,"(Translated by Google) Clean guesthouse, enthusiastic owner. Opposite Hanoi Medical University Hospital, so it is very convenient for resting and waiting for results. …",5/5
299,Nhà nghỉ Năm Thanh,"Nhà nghỉ sạch,rẻ,đẹp. Chủ nhà thật thà, nhiệt tình",5/5
300,Hanoi Family Homestay 2,"The manager is very rude!
We have booked a room on Agoda and when we arrived in Hanoi she wanted to charge us more because she put a wrong amount. …",1/5
301,Hanoi Family Homestay 2,"Worst place I've ever stayed. Never faced more inconvenient in my life. The dorm I booked was under construction (I had booked 2 months in advance). They didn't send mail. When I arrived at property, I was forced to pay more n stay in …",1/5
302,Hanoi Family Homestay 2,,1/5
303,Hanoi Family Homestay 2,"(Translated by Google) Rooms are clean, cheap
(Original)
Phòng sạch sẽ, giá rẻ",2/5
304,Hanoi Family Homestay 2,,2/5
305,Hanoi Family Homestay 2,"Perfectly decent, average place to spend a night or two in a perfectly quiet location not too far off from the old quarter. All in all this very simple hotel is nothing to write home about. And I can't help having the impression that a …",3/5
306,Hanoi Family Homestay 2,Reception is very nice!,3/5
307,Hanoi Family Homestay 2,,3/5
308,Hanoi Family Homestay 2,,3/5
309,Hanoi Family Homestay 2,(Translated by Google) Must be in a small lane about 20m to arrive. The owner is enthusiastic. There is a delicious noodle shop nearby .. …,4/5
310,Amorita Boutique Hotel,"As seems typical for this area of Hanoi, the staff are always very friendly and helpful.. the rooms are pleasant enough, and and the breakfast provided was okay (we had better at the previous hotel nearby). …",3/5
311,Amorita Boutique Hotel,"Very good hotel staff.
They took care of us very nicely.
We stayed there for couple of times. …",5/5
312,Amorita Boutique Hotel,"Excellent hotel for the money. Nice location in Hanoi's old quarter. Only a few blocks from the water puppet theatre and lake temple.
The staff was very very friendly. Free breakfast was excellent as well. Larger pillows would be nice, and hair conditioner. Really enjoyed our stay.",5/5
313,Amorita Boutique Hotel,"Nice hotel with very friendly and helpful staff! Rooms are very clean, but may not have an outside window (mine didn‘t) which may prevent traffic noise. Just avoid the rooms next to the elevators, that noise can be very annoying... …",4/5
314,Amorita Boutique Hotel,"There are few places we've felt as welcomed and taken care of as we've been here. We stayed here for three nights. We were some tricky guests with some last minutes rearrangements, but they managed it really well. The staff were really friendly and attentive. As for the location, it's as central as it could get.",5/5
315,Amorita Boutique Hotel,A small boutique hotel in Old Quarter but with a big heart.  We planned a North Vietnam trip for 9 days and used Hanoi as our base while we moved to different places. Amorita is located ideally in Old Quarter near the lake and also close to …,5/5
316,Amorita Boutique Hotel,The service here really nice. I can honestly say that without exception all the staff were friendly and very helpful. We were given the highest (7th) floor suite and it was really nice. Michael recommended lots of great things to see as well as helped us with onwards travel arrangements.,4.8/5
317,Amorita Boutique Hotel,"Didn't have a single problem and the service was exactly what I asked for. Their English is very good so the language barrier isn't too bad. Didn't fancy that you need your card to access the ""power"" I couldn't charge my devices when I leave my room but regardless of that... I enjoyed my stay.",4/5
318,Amorita Boutique Hotel,"Rooms are neat and tidy.
The breakfast they provided is quite good, and they change up the menu every …",4/5
319,Amorita Boutique Hotel,"Nice staff, nice location and the room was so clean. Just loved the accommodation.",4/5
320,Hanoi Backpackersuite Hostel,Bad hostel overall. The rooms are near the bar and it gets very noisy. The bathooms were also very dirty with hair all over the place and also poo stains in the toilets. The curtains were half broken so it didn't really add any privacy. …,1/5
321,Hanoi Backpackersuite Hostel,"We booked a bus tour to Sapa with the owner of the hostel and we agreed on 920k which he said is a good deal for the green bus. What we got was queen cafe bus.
Don't go with queen cafe bus, it was horrible. Book your tours online and NOT with the hostel!",1/5
322,Hanoi Backpackersuite Hostel,They failed to honor our bookings and we had a terrible experience with management. We had three major issues: …,1/5
323,Hanoi Backpackersuite Hostel,It doesn't lolk like the pictures you can find.... The are no lockers where you can put your backpack or luggage.....you will find some small lockers which don't work because broken... During the nigjt the building will shake because of the train... One of the worst hostel I have ever been,1/5
324,Hanoi Backpackersuite Hostel,Terrible service!,1/5
325,Hanoi Backpackersuite Hostel,"(Translated by Google) Not recommended! The room was really dirty, there were everywhere leftovers on the table, our sheets were dirty, the bathroom was totally dirty and the sink looked like it would almost fall off. It looked like the …",1/5
326,Hanoi Backpackersuite Hostel,"(Translated by Google) I stayed in the dormitory because it looked beautiful in the picture when I made a reservation, but the smell of ammonia smelled from the toilet attached in the room was the worst, no hot water in the shower, no …",1/5
327,Hanoi Backpackersuite Hostel,"(Translated by Google) !!!! Double room ""DELUXE"" or rather HORRIBLE.
Odor and presence of intense humidity in the room. Deodorants have been used to …",1/5
328,Hanoi Backpackersuite Hostel,"(Translated by Google) Following the positive reviews on TripAdvisor, .. we decided to choose this location for our night. We unfortunately have to opt for a double room located on the 4th floor. This room had a big humidity problem, stain …",1/5
329,Hanoi Backpackersuite Hostel,"(Translated by Google) -Rooms are way too noisy
-Shower and toilet are together (without partition)
- hard mattresses …",1/5
330,Hanoi La Vision Hotel,We booked online and the hotel overbooked. Left us without a hotel on a Saturday night at 6pm. Nothing anywhere remotely close was in our price range. Staff was not helpful at all. Proceed with caution when booking unless you book in person.,1/5
331,Hanoi La Vision Hotel,I was very surprised that this hotel has good reputation. This hotel has a very serious problem. Smelly room. Water facility without normal operation. There is no elevator.,1/5
332,Hanoi La Vision Hotel,"I made a reservation and asked about shuttle service from the airport. After many days of no reply, I asked them again but still no reply after many days so I cancelled my reservation.",1/5
333,Hanoi La Vision Hotel,(Translated by Google) the staff in this hotel had two faces. there was my payment between two faces. …,1/5
334,Hanoi La Vision Hotel,"(Translated by Google) worst. I suddenly changed the room .. even into a cheaper room. Refunds do not take place at the time of reservation, but rather at the current price. The ants were floating in the coffee pot and could not write …",1/5
335,Hanoi La Vision Hotel,"(Translated by Google) When I checked in, the room was overbooked, so I was told that I had to move it to another hotel of the same class, so I thought it would be the same level or a better level room. However, the condition of the hotel I …",1/5
336,Hanoi La Vision Hotel,,1/5
337,Hanoi La Vision Hotel,,1/5
338,Hanoi La Vision Hotel,Dirty toilet when checked in and even though I complained it kept dirty. Couldn't close shower door and there was missing tiles to stop the passage of water so I got the bathroom wet. They Will charge money if you use the towel to stop the water from weating the bathroom. Dirty towel also. Avoid it if you can.,2/5
339,Hanoi La Vision Hotel,"(Translated by Google) I was good at English and stayed comfortably. The sticky king was changed. The hiring is too severe. If you come across a lot of hips, you'll be bewildered. …",2/5
340,Hanoi Eclipse Hotel,"(Translated by Google) VERY BAD I WAS ALONE AND THEY TRIED TO ENTER THE ROOM WHEN I SLEEP WITH THE NOISE OF THE LOCK I WAKE UP, OFTEN FRIGHT I DO NOT RECOMMEND IT …",1/5
341,Hanoi Eclipse Hotel,,2/5
342,Hanoi Eclipse Hotel,,2/5
343,Hanoi Eclipse Hotel,,4/5
344,Hanoi Eclipse Hotel,,4/5
345,Hanoi Eclipse Hotel,"(Translated by Google) Good hotel, ideal to spend one or two nights.
The shower is perfect and the bed super comfortable.
And most importantly, great prices! 👌🏼 …",5/5
346,Hanoi Eclipse Hotel,"(Translated by Google) Nice, professional
(Original)
Đẹp, chuyên nghiệp",5/5
347,HANZ Hanoi Grand Maison Hotel,"(Translated by Google) This predecessor was a gratitude hotel, people often sneak into the room to steal money, change the name and do it again …",1/5
348,HANZ Hanoi Grand Maison Hotel,"(Translated by Google) New, clean hotel, around many delicious eateries. Very close to Dong Xuan market, busy during the day, quiet at night. enjoyed this hotel …",4/5
349,HANZ Hanoi Grand Maison Hotel,"(Translated by Google) Everything is quite new in the new hotel, quite surprising when the room price is very cheap. will support the hotel for a long time …",4/5
350,HANZ Hanoi Grand Maison Hotel,"(Translated by Google) Very good service
(Original)
Dịch vụ rất tốt",4/5
351,HANZ Hanoi Grand Maison Hotel,recommend!,5/5
352,HANZ Hanoi Grand Maison Hotel,"(Translated by Google) The room is beautiful and clean, everything is ok, the owner is very lovely. In short, it's a place you should visit if you come to Hanoi to play …",5/5
353,HANZ Hanoi Grand Maison Hotel,"(Translated by Google) My team booked this hotel for 4 nights, during the stay here, I found ks working very well. despite the season, services are also severely limited. But keeping the rooms clean is done very well by the hotel. …",5/5
354,HANZ Hanoi Grand Maison Hotel,"(Translated by Google) Large room space, not too lavish or splendid, but the receptionist and staff are very enthusiastic. I stayed 3 nights very comfortably. Good price. The shuttle was very punctual. …",5/5
355,HANZ Hanoi Grand Maison Hotel,"(Translated by Google) Last week, my family had the opportunity to go to Hanoi for a business trip and stayed at this Hanoi De Maison Grand hotel. It's beautiful and convenient, nice staff, happy service, room rates are also cheap. I give …",5/5
356,HANZ Hanoi Grand Maison Hotel,"(Translated by Google) Cheap hotel in the old town, attentive service, enthusiastic, will support long! …",5/5
357,Hanoi Prime Center Hotel,"We loved our time here! The room was clean, comfortable and modern.
The breakfast is very good and the staff is always ready to help you and satisfy your requests. The location is perfect if you want to have an understanding of …",5/5
358,Hanoi Prime Center Hotel,Very friendly staff and great service! Our room was quiet and clean. Towels were changed on a daily basis. We also bought our SIM-cards there and they work perfectly (9GB for a month for around 9 Euro). If you are travelling on a …,5/5
359,Hanoi Prime Center Hotel,"This is the best place to stay in Hanoi. Reasons why...
1). Friendly and nice staff.
2). Well located. …",5/5
360,Hanoi Prime Center Hotel,I am happy and pleased to stay at the hotel. The room is very clean. Very attentive and hands-on staffs! Strategic location at Hanoi Old Quarter area. So happy to find this hotel. Recommended!,5/5
361,Hanoi Prime Center Hotel,"Great staff, and amazing location. I highly recommend as the area you're in is special. The hosts here will take care of you and you get a great free breakfast. Rooms are very clean and spotless. If you need anything you can ask the front desk and they will do everything they can to take care of your needs to make your stay amazing.",5/5
362,Hanoi Prime Center Hotel,"Despite the great location, free bike parking and spotless, good value rooms I can't rate this hotel higher. A disastrous WiFi connection is a definite deal breaker in a big city hotel in 2020, but even worse is dishonest service. They …",2/5
363,Hanoi Prime Center Hotel,"Brilliant hotel - staff were friendly and really went out of their way to make us feel welcome. We arrived at 4am (we misjudged our night bus timings) and had to buzz in at that time, waking up the staff member at the desk. They couldn't …",5/5
364,Hanoi Prime Center Hotel,I only got to experience this place for a few hours but the time I was there I felt very welcome and safe. The room was very clean and modern and only 10 minutes walk from local shops and restaurants. I was so touched how the staff go out …,5/5
365,Hanoi Prime Center Hotel,"The best room I have ever stayed for less than $20. The room was lovely, with a fridge, TV, fan and air con. The staff were super helpful and friendly. Would definitely stay here again.",5/5
366,Hanoi Prime Center Hotel,"We had a nice stay at this hotel. The staff is really friendly and also gave us a great overview on what to do in the area.
Also we liked the breakfast buffet. …",5/5
367,Emerald Trendy Hotel,"Great place, super helpful and friendly staff. They took great care of us and our two small children. We really felt at home. The rooms are nice and we got a free baby cot also. We chose the bigger size and that was great! Highly recommend!!",5/5
368,Emerald Trendy Hotel,"The customer service was impeccable of for such a great value. The staff cohesively made our stay very memorable. Thanks to Jasmine for helping us plan trips, transport, tours and was very helpful before our visit with excellent …",5/5
369,Emerald Trendy Hotel,"Fantastic service, welcoming staff and clean and comfortable hotel. I am a repeat visitor. There is so much to recommend. The location is superb, within walking distance of the lake and many delicious restaurants. But what makes this hotel …",5/5
370,Emerald Trendy Hotel,"Great location, sensational service!
This hotel set an all-time record for best and most personal service. (And I …",5/5
371,Emerald Trendy Hotel,The best thing about this hotel is the staff! They’re so friendly and always ready to help you.,5/5
372,Emerald Trendy Hotel,The staff in Hanoi Emerald Waters Hotel Trendy is beyond excellent! They should take pride of how they look after their guests. Exceptional customer service. They always make sure that all your needs are well attended. We had an incident …,5/5
373,Emerald Trendy Hotel,Excellent accommodation. Really clean. Great atmopshere. Breakfast is sensational with a great variety to choose from. The staff are so wonderful and friendly. They are so helpful. Always asking us if we need any information or assistance.,5/5
374,Emerald Trendy Hotel,"Incredible time in Hanoi simply due to the care, attention and high level of service. If you are a family looking to visit Hanoi, then definitely stay with them as they are so so accommodating. …",5/5
375,Emerald Trendy Hotel,"Always as excellent as I've expected. Perfect location, close to lake and at same time avoid the traffic inside of the old town. Perfect service, smile always on the face of each staff.",5/5
376,Emerald Trendy Hotel,"very nice location, 10 min walk from old town, great breakfast, the rooms are a little too small, personnel is professional and helpful. I would choose it again for my next stay in Hanoi. Book in advance so you can have a deal. I m not giving 5 because the room was a bit too small. I recommend.",4/5
377,Eclipse Legend Hotel,"Overall quite okay. You received what you paid for. It is decent for a three star but I would advise not to expect too much. The breakfast consisted of four to five kinds of fruits and five warm dishes. The staff was friendly and helpful. They helped us call our tour group, which was nice.",4/5
378,Eclipse Legend Hotel,"Lovely breakfast buffet. The rooms are soundproofed from the noisy roads below which is great. I recommend not staying in the honeymoon suite, the round beds are not ideal. The staff are fab. Be sure you get back to the hotel before …",4/5
379,Eclipse Legend Hotel,The reception people and all staff here were awesome! Loved the complimentary tea on arrival. Amanda at the front desk gave us a city map and highlighted all the spots we might want to see. They were great at communication ahead of time …,5/5
380,Eclipse Legend Hotel,"We really can't wait to be back. Greatest staff in Hanoi. My room had been very recently renovated. Front desk was as always very nice, eager to please. The housekeeping did a fantastic job on a daily basis. The staff was really accommodating and friendly. You truly get what you pay for here.",4.8/5
381,Eclipse Legend Hotel,"Friendly and helpful staff and gave me two great recommendations for food in the neighborhood. I paid $975,000 VND total for 2 nights. Great deal. Bonus: they upgraded me the first night as my room was not ready. The hotel was close to …",3/5
382,Eclipse Legend Hotel,"The services was good and the receptionists were friendly and helpful. The room was clean and comfortable but if you prefer a quiet room, ask one without windows facing the street. The breakfast was tasteful for a budget hotel.",5/5
383,Eclipse Legend Hotel,The whole property is extremely clean. The hotel’s transportation is very convenient. Great way to indulge yourself great meal. The air conditioning was very effective. The neighborhood itself is quite nice to walk around. Really good interactions with guest services prior to my visit. There are lots of restaurants nearby.,5/5
384,Eclipse Legend Hotel,"When I came to Hanoi for a marathon event, I stayed 1 night in room 502.
Hotel location is good. The room facilities were acceptable to me.
However, there is a serious problem that the hotel’s owner needs to fix. It was …",3/5
385,Eclipse Legend Hotel,"- great position
- my room quite cheap but the condition of the room is not so good
+ water leak in the toilet even no one use.",3/5
386,Eclipse Legend Hotel,Me and my brother had the most wonderful stay in Hanoi especially at Eclipse Legend Hotel. The staff saw this and ran out to help us across the road. The rooms were clean and more space. The location of the hotel is great for the old quarter and the lake.,5/5
387,OYO 619 Chikoo Homestay (spot-on),"(Translated by Google) Low quality
(Original)
Chất lượng kém",2/5
388,OYO 619 Chikoo Homestay (spot-on),"The beds are AMAZING! I have not slept on a more comfortable bed in years! Friendly service and goes out of their way to assist you.Thank you Chikoo, I will be back when I am in Hanoi again 👍",5/5
389,OYO 619 Chikoo Homestay (spot-on),Very good family always smile and do the max for help you. Never see place so clean like here. And very good price,5/5
390,OYO 619 Chikoo Homestay (spot-on),,5/5
391,OYO 619 Chikoo Homestay (spot-on),,5/5
392,OYO 619 Chikoo Homestay (spot-on),,5/5
393,Hong Anh Hotel 3F,,1/5
394,Hong Anh Hotel 3F,,1/5
395,Hong Anh Hotel 3F,,1/5
396,Hong Anh Hotel 3F,,2/5
397,Hong Anh Hotel 3F,Decent service apartment. Nothing fancy. the housekeeper was helpful.,3/5
398,Hong Anh Hotel 3F,,3/5
399,Hong Anh Hotel 3F,"(Translated by Google) Clean
(Original)
Sạch sẽ",4/5
400,Hong Anh Hotel 3F,,5/5
401,RedDoorz near Nha Tho Street,Excellent location,5/5
402,Hanoi Marvellous Hotel & Spa,"Five years later as as I tidy my old wardrobe I found the items they decorate my room in when it was my birthday
My family found this the best and kindest hotel we stayed in in all our travels and so I stop my cleaning to add this memory to there hard work",5/5
403,Hanoi Marvellous Hotel & Spa,"Thanks to 'hong men'&'theanh'
If I come back to Hanoi, I will definitely come back to this hotel. …",5/5
404,Hanoi Marvellous Hotel & Spa,We started off our anniversary trip in Hanoi at this wonderful hotel. We stayed for 3 nights at this beautiful hotel. The location is very central and you can walk to the main tourist attractions. The staff are extremely welcoming and …,5/5
405,Hanoi Marvellous Hotel & Spa,"Perfect home base for a trip to Hanoi's bustling old quarter! The hotel is tranquil, comfy and clean. The staff is attentive and helpful. The location is great, so much yummy street food around every corner! …",5/5
406,Hanoi Marvellous Hotel & Spa,Such a lovely place with warm hearts. If you are looking something in the mid of city at Hanoi. Marvellous is a great place. They even suggest places around. Everything is nearby and its very easy to visit places. Rooms were big and clean. We stayed for 3 nights and it was too good. Breakfast was decent and tasty.,5/5
407,Hanoi Marvellous Hotel & Spa,"We stayed one night at Hanoi Marvellous Hotel for our honeymoon. It was our first night ever in Vietnam and Hanoi. We aren’t familiar with local accommodation standards, but this is by far the best hotel experience we ever had for this …",5/5
408,Hanoi Marvellous Hotel & Spa,"The customer service was the best I have experienced in Vietnam. From the smiles and greetings from staff (not always a given in other hotels unfortunately), to the outstanding service provided by Daniel and his team. Our potential needs …",5/5
409,Hanoi Marvellous Hotel & Spa,"This hotel is located in the Old Quarter. The staff is fantastic and went out of their ways to make sure that our stay was great. They offer delicious breakfast daily. Their bed is super comfy. Contrary to other reviews, there is no noise …",5/5
410,Hanoi Marvellous Hotel & Spa,"We chose this hotel based on all the amazing reviews but I could not expect this to be as good as it was! The stuff here is something extraordinary! Each one of them knows you by name and treat you so kindly , it feels like you’re back …",5/5
411,Hanoi Marvellous Hotel & Spa,"Stayed here two days, the staff and accommodations were perfect. The front desk helpful with questions and directions. Room was spotless and the bed was so comfortable. Eat at the hotel twice, delicious. Location convenient for lake and old town. Highly recommend.",5/5
412,Hanoi Sky Hotel,"Poor hotel located in a narrownroad that cars cannot stop for pick up and drop off.
In from there is a restaurant that celebrates weddings. So, it is very noisy …",1/5
413,Hanoi Sky Hotel,"We booked the room for 3 nights and they told us to go after one night because they had a big group of people coming and they had to give our room to them. Very poor service of telling a customer to go for others, will never recommend to anyone!",1/5
414,Hanoi Sky Hotel,"No no and no plus no. This is the first time I give one star and the charge rate to local is like 30usd per night . But for foreigner, that goes up to 150usd per night. It is a 360 change when the moment they see your passport. I am fine …",1/5
415,Hanoi Sky Hotel,"This hotel charges local 50 usd per night and 200 usd for foreigners especially whiteman, what a sense of humiliation",1/5
416,Hanoi Sky Hotel,"(Translated by Google) Too bad. Call, text to pay the deposit, the room that the customer said the boss for twin or single, said ks will call back. Finally im always. Did not see what ks to call, texting is also silent. Too bad. …",1/5
417,Hanoi Sky Hotel,"(Translated by Google) It is a perfect light. Until one day, it was good for the price, but I made a reservation for 3 days and paid all the money, but... I was kicked out during the tour. They went into the room at their own pace and put …",1/5
418,Hanoi Sky Hotel,,1/5
419,Hanoi Sky Hotel,,1/5
420,Hanoi Sky Hotel,Very noisy at night and early morning. We stayed in 2 different rooms across 4 nights. The second room wasn't clean (hair in the shower/bath and on the glass shelves). The water leaked out of the shower everywhere and smelt damp all the …,2/5
421,Hanoi Sky Hotel,"Staff was great, price was fair, good location, but it has a few long term oil industry men staying there who well how shall I politely say bring in regularly women of the oldest profession in the world regularly! Staff is wonderful. But, I personally would avoid it.",2/5
422,Opera House Suites,It's a brand new hotel. Very friendly staffs and manager was very helpful and attentive. Out room was upgraded from city view room into a room with balcony. The second night we were back to the original room type. Turned out the room with …,5/5
423,Opera House Suites,I have been travelled to Hanoi back & forward in last 12 years. I have stayed different locations in the center. First impression I was surprised by a main dynamic door color & warm welcome with a smile on the staff's faces. …,5/5
424,Opera House Suites,"This place is amazing, the location is right in the centry of Hanoi next to Hanoi Opera Threater. Go anywhere would still be near ^^",5/5
425,Opera House Suites,Back to here and still love it,5/5
426,Opera House Suites,"(Translated by Google) By chance during an outing, 2ce I booked a room here. The room is clean and beautiful ⭐️ The receptionists are very enthusiastic, attentive and cute 10 points ❤️ ^^. Affordable. I've been in quite a few test rooms and …",5/5
427,Opera House Suites,(Translated by Google) The hotel is very nice and the price is very reasonable. The location right in the middle of the capital with such a price surprised me quite a bit. The staff are enthusiastic and very professional. 5* is my rating. …,5/5
