,hotel_name,review,rating
562,Hanoi Vision Boutique Hotel,"I strongly advise against staying at this hotel: my purse, containing passport and credit cards, was stolen from inside my hotel room while I was asleep. The hotel was likely involved and handled matters in a way that raises more questions …",1/5
563,Hanoi Vision Boutique Hotel,"Location of this hotel is really nice! Just walk out few steps and you can see the Saint Joseph Cathedral, and walk two more blocks you can find the gorgeous lake which is very good to walk around after dinner! …",5/5
564,Hanoi Vision Boutique Hotel,"Scam, and a waste of time. They tried to move us to a different hotel on a busy street with loud rooms. Looks like they do this frequently, based on other reviews. We ended up wasting an hour with them shuffling us back and forth before we bailed and got a room at a different hotel.",1/5
565,Khách sạn A83 xã đàn,The attendants are not really truthful. Disappointed,1/5
566,Khách sạn A83 xã đàn,"(Translated by Google) The hotel stole the hotel jewelry everyone !!! There was one girl who was given the jewelry she put in her box by her Chinese boyfriend, but still got it, she asked for an orange check but the cleaning agent hid it. …",1/5
567,Khách sạn A83 xã đàn,"(Translated by Google) The room is small, the price list at the first 2 hours is VND 150,000 but the fee is 200,000 VND …",1/5
568,Khách sạn A83 xã đàn,(Translated by Google) The hotel picked up the guests. Who should be careful. It is best to avoid this hotel. Wishing the hotel fast bankruptcy. Doing business like pants. 🙂 …,1/5
569,Khách sạn A83 xã đàn,"(Translated by Google) Hotel swallows đồ
Please be careful if you bring valuables into the hotel. …",1/5
570,Khách sạn A83 xã đàn,,1/5
571,Khách sạn A83 xã đàn,,1/5
572,Khách sạn A83 xã đàn,,1/5
573,Khách sạn A83 xã đàn,,1/5
574,Khách sạn A83 xã đàn,So so.,2/5
575,Hoan Kiem Lake Hotel,NO LIFT!HORRENDOUS ASCENT TO YOUR ROOM take your climbing gear with you.The pits but fairly cheap.Rooms are basic backpackers.,1/5
576,Hoan Kiem Lake Hotel,"OMG! There ins't elevator here @.@ you must be crazy for going upstair if your room on 3rd or 4th floor. Poor me. I didn't know this.
Moreover, the air condition is too week, telephone is crash. Room is no …",1/5
577,Hoan Kiem Lake Hotel,"Small room, small stair, no elevator ...not free drinking water .... oh my god ...",1/5
578,Hoan Kiem Lake Hotel,Filthy Hostel. This is not a hotel. It is a dump.,1/5
579,Hoan Kiem Lake Hotel,Poor in all manner,1/5
580,Hoan Kiem Lake Hotel,"(Translated by Google) I have been here for 5 days, the waitresses are too old, the room is too old with the famous hotel is a 2-star hotel, an old blanket and bed sheet, the bathroom is broken, the faucet is turned on and down, cup tray If …",1/5
581,Hoan Kiem Lake Hotel,(Translated by Google) -Its used in shortage.Interior furniture. Not true with advertising. …,1/5
582,Hoan Kiem Lake Hotel,(Translated by Google) No elevator. Very many stairs. Check-out is two hours late and requires half the price of the room. :( …,1/5
583,Hoan Kiem Lake Hotel,"(Translated by Google) So bad. Everyone should avoid it when they are here ..
(Original) …",1/5
584,Hoan Kiem Lake Hotel,"(Translated by Google) Too bad
(Original)
Quá tệ",1/5
585,Golden Diamond Hotel,"Postives: friendly and helpful staff.
Negatives: Room was covered in mould, pictures looked like they were taken a long time ago. Would not recommend",1/5
586,Golden Diamond Hotel,"I made a paid confirmed booking for 1 night on 01/12 through Agoda. Staying overnight in my friend's room and on 28/11 while having hotel breakfast, I passed my printout for the booking and passed it to the worker, Jonathan, and informed …",1/5
587,Golden Diamond Hotel,"The rooms ok. Now the bad things.
If you are coming, please don’t arrive late night, the receptionist is the most unprofessional, impolite, and incredible rude guy I ever met in an hotel. He …",1/5
588,Golden Diamond Hotel,We recommended this place to a couple from England. When we arrived the guy from the reception told us that we have to wait for our room (cleaning). It was 5pm and check in is at 2pm! …,1/5
589,Golden Diamond Hotel,"Hotel itself is nice and budget, and new rooms are just excellent, BUT: it’s seems like there is no any point to book a room here. I come to Hanoi very often and always book a room there, but every other time receptionist says that they …",1/5
590,Golden Diamond Hotel,"Put us in level three, get the heavy baggages to level 3 on own as there is No lift, angry and unwelcome receptionist ..haha.. never again",1/5
591,Golden Diamond Hotel,"The employee gave me a different room than the picture room. It's a very humid, dirty room. The bathroom is the terrible. I didn't use the bathroom.The reservation system is very poor",1/5
592,Golden Diamond Hotel,"We had a terrifying near death experience. My wife and I are both physicians, take our word when we say, do not deal with these people. They sent some guy in his personal car to pick us up from the airport at 8pm who only spoke vitnamese …",1/5
593,Golden Diamond Hotel,Horrible place. Service is pathetic nd attitude of staff is appalling. DON'T GO. It's not worth anything,1/5
594,Golden Diamond Hotel,"Included ""breakfast"" are just instant noodles. Not recommended to stay here given the availability of many other options in Hanoi.",1/5
595,OYO 276 Bh Hotel,Quiet overnight stay for couple..Amazing modern and spacious rooms for very affordable prices. Exceptionally clean. Very quiet. Great size bathroom with enough room for 2 or more.The hotel is not close to the tourist area of Hanoi. …,5/5
596,OYO 276 Bh Hotel,"A very pleasant stay. We were both really impressed with our rooms: very clean and comfortable with good facilities. We also really enjoyed chatting to Grandad in the foyer!. The location is reasonable, but there&#39;s a very, very busy road you need to c",5/5
597,OYO 276 Bh Hotel,"The room was dirty, the interior partially damaged or didn’t work at all!!! Like the bed lights seemed to have been ripped of the ceiling. And the view outside our window was a wonderful construction side wall. Scooters who have been parked …",1/5
598,OYO 276 Bh Hotel,"Je recommande Accueil sympa en anglais parfait, la chambre est propre bien équipé et le lit est confortable. L&#39;hôtel est très calme situé dans une petite ruelle. Ils m ont permis de garer ma moto dans le hall de l&#39;hôtel pour la nuit. Merci à vous !!! Je conseille cet établissement .Wifi moyen",5/5
599,OYO 276 Bh Hotel,"One of the better hotels for the price.. OYO 276 ticks all the boxes when you require a clean large room, good bed, with the bathroom having great showers. I&#39;ve stayed in 3 different types of rooms over a week and all the amenities are the same. It is a quiet and safe hotel. The staff are always attentive and caring.",5/5
600,OYO 276 Bh Hotel,Nice new hotel down a alley. On the wrong side of a busy road if you want to see the old quarter. But the price is right. The view of the red river is nice from the 6th floor. Ran out of hot water in my morning shower. There is a kettle but No water or coffee in the room.,4/5
601,OYO 276 Bh Hotel,Spacious room and clean. Chair and small table for working. Room quite new. 501 with River view would be the best choice. I am happy with that 😊. I made bookings via OYO app offered me extra discount 👍,5/5
602,OYO 276 Bh Hotel,"Lu2019équipe est très sympathique, merci !nLa chambre était parfaite, 7eme étage avec vue sur le fleuve dans une immense chambre, tout était propre et confortable. Rapport qualité&#47;prix excellent .Seul petit bémol, nous avons entendu un fond de basses de musique du2019un autre immeuble le matin",5/5
603,OYO 276 Bh Hotel,"Though this was a little further of a walk to the old quarter and much of Hanoi, and you had to cross a very busy street, it was more quiet and restful than had we stayed in the Old Quarter. The room was big and clean. There was plenty of hot water, doing",5/5
604,OYO 276 Bh Hotel,"A good base to go off exploring Hanoi.. Very friendly and helpful staff. Quickly arranged bike rental, airport transfers etc.... No coffee or tea in the rooms despite there being a kettle etc...",4/5
605,RedDoorz Plus near Benh Vien 108,"(Translated by Google) Like cc
(Original)
Như cc",1/5
606,RedDoorz Plus near Benh Vien 108,"(Translated by Google) Fully equipped, reasonable price
(Original) …",5/5
607,RedDoorz Plus near Benh Vien 108,"(Translated by Google) Room is very large and clean.
(Original)
Phòng rất rộng và sạch.",5/5
608,RedDoorz Plus near Benh Vien 108,,5/5
609,RedDoorz Plus near Benh Vien 108,,5/5
610,RedDoorz Plus near Benh Vien 108,,5/5
611,Grand Holiday Hotel 2,We enjoyed our stay at this hotel very much. The staff was very attentive and welcoming. My room had been very recently renovated. The landscape were beautiful throughout the day. The food quality is certainly great. There were several international television channels available. The room we stayed in was clean.,5/5
612,Grand Holiday Hotel 2,"I stayed for 4 nights. great hotel, great service with clean rooms and comfortable beds. Nice cntral location in the heart of the french quarter. I highly recommend this place. Tony the owner was very helpful and has assisted me in every way I requested.",5/5
613,Grand Holiday Hotel 2,"The hotel is located in the centre of old quarter. Tucked away location near lots of local food and attractions allowed us to explore some interesting parts of town. Booked through the hotel at a very reasonable cost. As they say, eat what the locals eat and you won't be wrong.",5/5
614,Grand Holiday Hotel 2,My boyfriend and I stayed at this hotel in July and we had an amazing experience. Room size was average for a hotel in the city. Rooms were quiet despite being in a busy quarter. We were always greeted with a friendly smile. From arrival to departure we were well taken care of.,5/5
615,Grand Holiday Hotel 2,I was so glad I booked this great hotel. Very clean during the whole stay. I found the staff to be very friendly and they helpful. The hotel sits in a good location. The hotel is located in the old quarter and the Hoan Kiem Lake can be reached by foot.,5/5
616,Grand Holiday Hotel 2,"I was lucky to stay in this hotel 3days while
hanoi tour.
Clean room condition with enough hot water …",5/5
617,Grand Holiday Hotel 2,"I was moved to the dorm here by Hanoi Travellers Hostel because they couldn't extend my stay with an AC room. In the dorm, the AC was stuck at 29C (84F). It would have been fine, but there was an unreachable window open so to avoid …",1/5
618,Grand Holiday Hotel 2,I stayed in multiple hostels in Hanoi and this was by far the best. There are always people to help you in the hotel. Rooms are generally a little larger than your standard hotel room. Carpets in the hallways are in poor condition. Book now for this excellent value of a hotel.,4.5/5
619,Grand Holiday Hotel 2,"Located in nice back packers area, rooms Old, not toooo comfortable, view of my room was in building site - Just 1m outside my window xd but its VietNam :)",3/5
620,Grand Holiday Hotel 2,"Very friendly staff, hotel clean room, very good value for money. Located 4minutes by walking from hoan kiem lake!",5/5
621,HanoiStyleHotel,Good hotel,5/5
622,HanoiStyleHotel,,5/5
623,Church Boutique Hotel,"It feels old and there is a small window facing the bed, the room is still bright we were having hard time taking a nap in the evening after long journey. With the price that we pay, we can get a much better hotel in the area. The pros is …",1/5
624,Church Boutique Hotel,"We arrived to Hanoi on the 3rd of April, 2017. Church Boutique Hotel was our first hotel in Vietnam, booked by a Vietnamese tourist agency.
The hotel is nothing like the pictures, rooms were very narrow, with no windows, …",1/5
625,Church Boutique Hotel,"There was a rat in our room. We asked to move and the only rooms that were available was the room next door and a room on another floor that the staff told us had a lice problem. We took the room next door and would you know it, 2 more rats …",1/5
626,Church Boutique Hotel,"Very bad experience here. The rooms are tiny, which is fine, but the hotel is generally in shabby condition. Loud mechanical noises throughout the night. And the WiFi did not work -- even when it was technically connected we couldn't access many websites.",1/5
627,Church Boutique Hotel,Room different from online. Fake advertising. Room is just enough to step in with luggage.,1/5
628,Church Boutique Hotel,Rat.running down corridor and paper thin walls,1/5
629,Church Boutique Hotel,"(Translated by Google) 3 meter wide hotel and therefore everything too cramped for breakfast, the hotel has had its prime for a long time. Fridge in the closet works right next to the bed. …",1/5
630,Church Boutique Hotel,Old room. Fridge doesnt work. Everything looks like run down. The buffet does not offer varieties. But the price is cheaper than other branch.,2/5
631,Church Boutique Hotel,"Moderate hotel if you're on a budget. Located in a very noisy part of town, but most of the rooms don't have any windows...so take your pick on that one. …",2/5
632,Church Boutique Hotel,Poor Hotel. Very lousy,2/5
633,Hanoi Silver Moon Lakeview Hotel,Standard.,3/5
634,Hanoi Silver Moon Lakeview Hotel,,4/5
635,Hanoi Silver Moon Lakeview Hotel,,4/5
636,Hanoi Silver Moon Lakeview Hotel,"Highly recommended, great location, lovely helpful, patient staff and honest staff - everyone speaks great English too. Recommended.",5/5
637,Hanoi Silver Moon Lakeview Hotel,Very helpful & friendly staff speaking good English Great breakfast Ideal location - quiet street in the old quarter near Hoam Kiem Lake I would definitely stay here again and recommend it for anyone staying in Hanoi.,5/5
638,Hanoi Silver Moon Lakeview Hotel,Service good & room good,5/5
639,Hanoi Silver Moon Lakeview Hotel,,5/5
640,Vision Premier Hotel & Spa,"We spent one day and one night in this hotel before moving to another one. The hotel itself is ok but expensive for the quality. They 'kinda' forgot to mention about a construction site right next to it. Worst, while napping after a 17 hour …",1/5
641,Vision Premier Hotel & Spa,What a great hotel for the price. Friendly staff and clean rooms plus the free breakfast in the mourning perfect way to start your day off in Hanoi. Dat Rooney was great at helping us set up day trips and arrange transportation two and from airport. I would recommend staying here when. every in haoi,5/5
642,Vision Premier Hotel & Spa,House keeping is bad and cheats you for money. AC doesn't work properly. There is mosquito in the hotel. The breakfast is limited and the hotel is very small unlike the pictures. I burnt my hand using their old school oven for toasting my bread and they didn't provide first aid even. Very very bad investment.,1/5
643,Vision Premier Hotel & Spa,"Excellent hotel! Was really clean, cosy and amazing breakfast (buffet).
One room for two= 27$. …",5/5
644,Vision Premier Hotel & Spa,Comfortable clean stay. Friendly staff. Good location. Would highly recommend. Excellent value for money,5/5
645,Vision Premier Hotel & Spa,Great friendly helpful staff. Helpful with tour booking & a fun day in Halong bay. Nice room & a great breakfast to get our day started in the morning,5/5
646,Vision Premier Hotel & Spa,Great location and very friendly staff. Our room itself was very clean and elegant while the breakfast was excellent and served early enough that we were able to eat before we were picked up for our day tours.,5/5
647,Vision Premier Hotel & Spa,Rosie speaks great English and is super helpful. The rooms are very nice and clean. Wifi not super fast. They are accommodating about leaving your stuff before or after check in. Good free breakfast.,5/5
648,Vision Premier Hotel & Spa,Very disgusting place. Door to the room had actual holes in it. Ants crawling up and down the walls. Bathroom stunk of sewage horribly bad. Lots of other bugs too. Dirty place. Don't stay here.,1/5
649,Vision Premier Hotel & Spa,"Clean room, very good tasty breakfast, stuff is very helpful, good localization near night market.",5/5
650,Millennium Hanoi Hotel,Too bad. Be careful with the staff!!,1/5
651,Millennium Hanoi Hotel,There is too nosiy here. The music came from other houses in the midnight made me could not sleep well.,1/5
652,Millennium Hanoi Hotel,"I booked a room with them in advance but when I came after checkin time, they offered a higher-price room otherwise I had to wait a long time for the booked room cleaning. What a disapoitment waiting for me after a tired trip. I will never come back this cheating hotel ever again.",1/5
653,Millennium Hanoi Hotel,"(Translated by Google) Called to book a room in advance, but when I came to check in, I reported that the room I ordered had a broken air conditioner and changed to another more expensive room; Room rate includes breakfast mainly …",1/5
654,Millennium Hanoi Hotel,"(Translated by Google) Everyone is careful with the housekeeping staff (the employee is a family member of the manager ks), cleaning the property.
Toilets collapsed and deteriorated …",1/5
655,Millennium Hanoi Hotel,"(Translated by Google) Be careful to lose your property !!
(Original) …",1/5
656,Millennium Hanoi Hotel,"(Translated by Google) Old and quite dirty
(Original)
Vétuste et assez sale",2/5
657,Millennium Hanoi Hotel,"Once staff and clean.
But, only burning water in our room. Night club on the other side of the road.
Forget the breakfast and get out for some quality. …",3/5
658,Millennium Hanoi Hotel,Pleasant time,3/5
659,Millennium Hanoi Hotel,Service ok ! Staff very funny ! Room service clear and clean,3/5
660,Blue 29 Hotel,"I was in private home nearby, not the hotel.",3/5
661,Blue 29 Hotel,The accomadation was clean and pleasent The room had plenty of space to move around in with comfortable furniture and extra large king size bed. The staff was very helpful and spoke enough English to meet all my needs. Definitely would stay again.,4/5
662,Blue 29 Hotel,"Very expensive, but more importantly, they charged me hidden fees upon checkout. Avoid.",1/5
663,Blue 29 Hotel,"It is clean and inexpensive. 600000 per day, VND 500000. Check-in after 6pm is VND 300,000 VND370,000. Problem: There is no service for bottled water.",5/5
664,Blue 29 Hotel,Clean room and great price.,4/5
665,Blue 29 Hotel,Good service,5/5
666,Blue 29 Hotel,"Situated in a dirty street, but the room is nice. Stayed only for one night, not far from the main sites of the city with a lot of places to eat around",4/5
667,Blue 29 Hotel,Good location hotel,5/5
668,Blue 29 Hotel,Ok,3/5
669,Blue 29 Hotel,very good!,5/5
670,Tu Linh Palace Hotel,"Good hotel, good service with chip price. I was feeling that i went to European bussiness trip instead of i am in Vietnam",5/5
671,Tu Linh Palace Hotel,Definitely this place for best in short staying and in budget . And also it's situated in main commerical areas of old quarters..hon kiem lake is nearer.Visited on Winter vacation Dec 2019 .. Hanoi is One of the finest and best winter …,4/5
672,Tu Linh Palace Hotel,The staff was very friendly and helpful. Rooms were a bit small but a good catch if you're looking for a budget friendly option. It is situated in the old quarter and all the market street were just infront of the hotel. We could access all …,4/5
673,Tu Linh Palace Hotel,Nice hotel to stay for along time,5/5
674,Tu Linh Palace Hotel,"This hotel is a mixed bag. The people at the hotel were really nice, helpful and accommodating. Also the location of the hotel is really good. However, the rooms are a total mixed bag. The first room was the 4 series and neither was the A/c …",3/5
675,Tu Linh Palace Hotel,"Small rooms. I had twin bed room, it was indeed small than I expected. Have to tidy to appreciate that space or else you will be walking over your own luggage. The breakfast was okay and service appreciated for that price was a good deal. No food prepared though, have to eat out before coming to hotel.",4/5
676,Tu Linh Palace Hotel,"Absolutely love this reasonably priced hotel and the staff here!!! Small boutique hotel in the Old Quarter made it easy to walk to the lake, Old Quarter shopping and food. The nice breakfast was a great way to start each day. The staff …",5/5
677,Tu Linh Palace Hotel,Great place to stay. Everything in walking range. Very friendly service,5/5
678,Tu Linh Palace Hotel,"Not bad. At least it's centrally located, cheap, CLEAN and QUIET. Small rooms doesn't matter much to me. Breakfast is acceptable for the price you pay, such as eggs, fried rice, bread, bacon, watermelon, banana, cheese, milk, tea, coffee.",5/5
679,Tu Linh Palace Hotel,Rooms are nice and clean with no glaring insufficiencies. Staff don't seem too attentive... They are nice but seem more preoccupied with their phones or coworkers. Breakfast can be skipped. You're better off walking a short distance to grab a bowl of soup somewhere.,4/5
680,North Hostel N.2,(Translated by Google) I booked with booking and upon arrival I wanted to raise the price to have AC …,1/5
681,North Hostel N.2,,1/5
682,North Hostel N.2,,1/5
683,North Hostel N.2,"The hostel is very cheap and staff is friendly, but rooms are a little bit ugly.",2/5
684,North Hostel N.2,"(Translated by Google) For picky and nervous people, I recommend looking for another place, for many reasons: 1. The interior walls are made of cardboard without soundproofing, so you can hear everything like in a hostel of 12 chairs. …",2/5
685,North Hostel N.2,Good,3/5
686,North Hostel N.2,"(Translated by Google) I came in 2015 and 2017 and nothing to change
Owner is great but hotel rooms deserve a good refresh
The price is quite low which compensates for the lack of equipment …",3/5
687,North Hostel N.2,,3/5
688,North Hostel N.2,,3/5
689,North Hostel N.2,,3/5
690,Rising Dragon Palace Hotel,This hotel is not conveniently located near the fascinating old city centre of Hanoi. A 20 minutes walk to the Hoan Kiem Lake and will take you about 30 minutes to central of Old Quarter. The staff is very friendly but their English is in …,1/5
691,Rising Dragon Palace Hotel,"Very disspointed hotel and it was far under from out expectation. We read alot of good reviews and nice pictures for this hotel but everything was totally different. Room was small, narrow and stained bath-room and alot of mold . bed sheet …",1/5
692,Rising Dragon Palace Hotel,"Poor hotel and bad service!
The hotel needs to improve in several areas. The plumbing in the hotel is poor. When the guests in the above room(s) flush their toilet, there will be a loud …",1/5
693,Rising Dragon Palace Hotel,"(Translated by Google) The worst staff I have ever seen is the only thing the hotel can score with is the location, you just get ripped off by the staff at the shuttle to or from the airport to change money or whatever to do with money it …",1/5
694,Rising Dragon Palace Hotel,(Translated by Google) We booked a taxi transfer to the airport via the hotel. We were told that the ride costs us around 12 €. On the day of departure we were at the end additionally on the amount 5% on it and additionally 15 USD again. …,1/5
695,Rising Dragon Palace Hotel,"(Translated by Google) Exclusion of Chinese and Taiwanese
(Original)
排斥中國人和台灣人入住",1/5
696,Rising Dragon Palace Hotel,,1/5
697,Rising Dragon Palace Hotel,"clean and decent interior
But so thin walls that I could hear all the next door people's talking and snoring sounds …",2/5
698,Rising Dragon Palace Hotel,"(Translated by Google) It differs a lot from pictures and is difficult to find...
Not sure about the kindness... …",2/5
699,Rising Dragon Palace Hotel,"(Translated by Google) Just Jengan Low Motel
(Original)
그냥 저냥 저가 모텔",2/5
700,Hanoi Ruby Guest House,"Nice friendly, clean, cheap place. Dorm on 6th floor, but spacious with lockers and small ensuite bathroom",4/5
701,Hanoi Ruby Guest House,"(Translated by Google) We booked a room for 3.
It's right in the center of the city we did everything on foot for the old town so the location is top notch. The room is big enough the comfortable beds. This …",4/5
702,Hanoi Ruby Guest House,"(Translated by Google) This is the travel agency office renovating the upper floors into a thinking room. Not a traditional hotel. Enthusiastic staff, right in the heart of the old town, convenient to travel. …",4/5
703,Hanoi Ruby Guest House,"Nice staff perfect service, room very clean, new and big but a little bit noisy from street outside, the location is perfect. Recommended!",5/5
704,Hanoi Ruby Guest House,We stayed in the triple room and it was clean and comfortable staff are very accomodating we loved it,5/5
705,Hanoi Ruby Guest House,"Perfect location, great price, very nice staff, amazing rooms, clean, comfortable, everything is just perfect!",5/5
706,Hanoi Ruby Guest House,"Nice place but the dorm is on sixth floor, without escalator",5/5
707,Hanoi Ruby Guest House,Nice house.,5/5
708,Hanoi Ruby Guest House,Good,5/5
709,Hanoi Ruby Guest House,"(Translated by Google) Room right in the center of the old town, affordable price …",5/5
710,Little Diamond Hotel Hanoi,"Sorry but terrible. Arrived and had a shower, bathroom flooded, nothing going down drain. Air con not working. Later in the evening cigarette smoke starts filling the room from a vent near the ceiling. Can barely breath trying to sleep. Pictures nothing like the room we had. So many better in Hanoi",1/5
