,hotel_name,review,rating
0,Charming Hotel Hanoi,They call it a 2 stars hotel. I've stayed in hostels which was 10 times better than this. The room was disgusting. You couldn't even walk because your feet were adhere. So dirty place I'd ever been. The staff are very bad at English too. …,1/5
1,Charming Hotel Hanoi,Disgusting. Let me start by saying we travel cheap and aren't picky - but this was beyond a joke. Checked in last minute and got a room full of awful damp in the bathroom and room itself. It stunk of writing and the floor and walls were …,1/5
2,Charming Hotel Hanoi,"Had a bad experience with this hotel. I booked and paid via Agoda, once arrived hotel said that there was no more room available and put me to another poor hotel, the new hotel gave me a room in the 6th floor without elevator. And the room is like a bird nest! Never book this hotel again",1/5
3,Charming Hotel Hanoi,"We arrived having booked online a couple days beforehand. The owner then tried to make up an excuse, when they had clearly just over booked. Following that they tried to move us to their friends hotel that was absolutely awful. After 10 minutes of arguing they finally gave us our money back. Wouldn't recommend.",1/5
4,Charming Hotel Hanoi,"We booked three rooms, one of them was cancelled 1 hour before we got there and half of our friends found another hotel. After the first night we went around the city and when we came back all of our luggage from one of the rooms was taken …",1/5
5,Charming Hotel Hanoi,The room is not really clean as I imganined. The staff’s attudude is quite and unprofessional. …,1/5
6,Charming Hotel Hanoi,"After finding the hotel in a grim and slightly scary alley, we found a very disappointing hotel foyer. Before reaching our room, we saw a mouse run from the kitchen towards the breakfast 'room'. The window-less hotel room was dirty and …",1/5
7,Charming Hotel Hanoi,"We stayed here on the 14th and 15th of February and booked a Sapa Trekking trip through this property for the 16th,17th, 18th. The accommodation itself was fine however I would not recommend that you book a trip through them as we were …",1/5
8,Charming Hotel Hanoi,Place was dirty. The toilet seat was broken so it wasn't attatched to the toilet itself. The bed was aceptable eventho the sheets were not the cleanest. But the entire place was old and had the smell of a place with roaches. Didn't see …,1/5
9,Charming Hotel Hanoi,"Don't recommend, the room was old and dirty, the breakfast was awful and cold.",1/5
10,Hanoi Golden Holiday Hotel,"Great hotel. 5 star service with 3 star price. They treated my daughter very well and help us a lot to have best vacation. Thank you all the team. You are the best.
Take care!",5/5
11,Hanoi Golden Holiday Hotel,The cutest hotel in the old quarter of Hanoi. Great location and amazing staff. I recommend getting a room with a bath and balcony if it’s available. Great view of the town from up there. The breakfast is very good and you can order off a menu as well as buffet. A great place to call home while you’re in Hanoi the city of Poets!,5/5
12,Hanoi Golden Holiday Hotel,"A truly satisfying stay with Hanoi Golden Holiday Hotel. From the staff, to the rooms and to breakfast, everything was amazing! The rooms are really of high standards. Comfortable beds, sparkling clean (really sparkling) toilets and a TV …",5/5
13,Hanoi Golden Holiday Hotel,"The hotel is situated near many local sights and is literally five minutes walk from the main hubbub.
The street it's on has some good bars and cafes. Likewise the whole area is …",5/5
14,Hanoi Golden Holiday Hotel,Amazing staff with amazing service. Thank you Ms Kim and all team. You are the best. Take care!!!,5/5
15,Hanoi Golden Holiday Hotel,"Superb. The room was amazing. Little details like rose petals and cloths shaped into dogs make a big difference. Bathroom was very nice; included a tub and a wide variety of toiletries. The staff were extremely helpful, friendly and engaging. Love this hotel.",5/5
16,Hanoi Golden Holiday Hotel,"This hotel is amazing!! Service was Excellent, very kind and generous. The Breakfast is rich and very tasty. The rooms are clean and smell wonderful.As soon as we arrived we received a glass of juice and fruits. Later we received a detailed …",5/5
17,Hanoi Golden Holiday Hotel,"Wonderful location with very decorated and appointed rooms.
The breakfasts are wonderful, and fresh hot tea and coffee are available all day for free. …",5/5
18,Hanoi Golden Holiday Hotel,"I was so pleased with my stay at this very well-located hotel. The room was large, clean and of a high standard, with a very comfortable bed. I loved coming back to relax and rest after a busy day of walking, exploring and eating my way …",5/5
19,Hanoi Golden Holiday Hotel,very clean. breakfast is unbelievable from passion fruits to omlets and pancakes made how you like them. amazing options. staff very friendly and helpful. rooms very clean and high standard. recommended!,5/5
20,Hanoi Pho Hotel,"Don't recommend this hotel at all. Very small room comparing on the photos. I booked two connection rooms for 4 people but when we checked in, we got only 1 room for 4 people. They are cheating. And the breakfast, we have 11 people but only …",1/5
21,Hanoi Pho Hotel,"Bad description / bad service / bad facilities
The places is not describe as what it is! …",1/5
22,Hanoi Pho Hotel,"The hotel has friendly staffs and they're always so. But the facility is not very clean. Further, and the biggest problem of the hotel is, the rooms are not sound proof. There was noise from the passage as well as from the streets. Couldn't even sleep properly the whole night.",1/5
23,Hanoi Pho Hotel,Don't be fooled by the photos!! Rooms are awful and have no windows. Avoid like the pest,1/5
24,Hanoi Pho Hotel,"(Translated by Google) There is no dissolution ceremony
(Original)
Không có lễ tan",1/5
25,Hanoi Pho Hotel,"(Translated by Google) We booked a superior and they put us in a zulito. The room was not clean, there were hairs everywhere, the shower head was broken and the parquet leaked water continuously. …",1/5
26,Hanoi Pho Hotel,(Translated by Google) Worst shower room No condensation Air conditioning Not cool …,1/5
27,Hanoi Pho Hotel,,1/5
28,Hanoi Pho Hotel,,1/5
29,Hanoi Pho Hotel,,1/5
30,Hanoi Old Decade Hotel,,1/5
31,Hanoi Old Decade Hotel,Very very very old,3/5
32,Hanoi Old Decade Hotel,,3/5
33,Hanoi Old Decade Hotel,It was good hotel . good staff and very kind,4/5
34,Hanoi Old Decade Hotel,Good hotel,4/5
35,Hanoi Old Decade Hotel,"(Translated by Google) Good service.
(Original)
Dịch vụ tốt.",4/5
36,Hanoi Old Decade Hotel,"(Translated by Google) Everything was good, but the pressure was a little strong …",4/5
37,Hanoi Old Decade Hotel,"(Translated by Google) Nice little hotel, comfortable bedding and really nice and helpful staff. …",4/5
38,Hanoi Old Decade Hotel,"(Translated by Google) Mandatory for every visit to Cologne
(Original)
Pflicht bei jedem Köln-Besuch",4/5
39,Hanoi Old Decade Hotel,,4/5
40,Golden Charm Hotel,In the maze of streets is located Golden Charm Hotel. A very non descriptive entrance but comfortable clean rooms. The staff were courteous but the only meal provided was breakfast. …,3.5/5
41,Golden Charm Hotel,"Absolutely the best service with unbeatable price.
Very good if your here for a short stay.
Hotel is conveniently located in the old quarter. Clean and with excellent/ …",4/5
42,Golden Charm Hotel,My stay here was comfortable and pleasant. The location of this hotel is quite central and its filled with a lot of eating options. There's a few convenience store around as well for water and others. The rooms itself was clean and …,5/5
43,Golden Charm Hotel,"Noisy rooms, cheap / uncomfortable beds, and pillows that were so full of cotton that your head would need to be at a 90 degree angle to sleep... I arrived at the hotel and immediately informed the front desk staff that I was unhappy with …",2/5
44,Golden Charm Hotel,Good budget hotel. In the market area of Ha Noi. Staff is cooperative. The door locks were damaged for our room. Ambience is not very good. The balconies are very small and cannot be used. Food is limited and has to be called from the kitchen regularly. It's an ok hotel for high price tag.,3/5
45,Golden Charm Hotel,We had already stayed in this very hotel from 27 Sep to 29 Sep 2019. Had checked out for only one day to avail the H***** Bay cruise. …,2.5/5
46,Golden Charm Hotel,"Pretty good location, the rooms and shower were alright. Air-conditioning was working fine and wifi signal was alright. Walking distance to lots of attractions and the staff were pretty helpful.",4/5
47,Golden Charm Hotel,We loved it to stay over there. The staff always make sure of our comfort. Special thanks to Ms.Ly who always been there for all kind of help and support. Thank you,5/5
48,Golden Charm Hotel,"Beautiful boutique hotel in the old quarter of Hanoi. Owner also offers trips to North Country of Vietnam. Pagottas, watts, rice terraces, old villages. Its the best part of being in Hanoi.",5/5
49,Golden Charm Hotel,We stayed here as a family twice during our visit to Vietnam. The complimentary breakfast was one of the better that we have had while on our travels. The rooms are well appointed with good bunk beds and TVs with good channel options for …,5/5
50,Arowana Hotel,". phòng xuống cấp, mùi ẩm mốc rất khó chịu. tôi mua xịt phòng để xịt mà vẫn ko thể hết được mùi ẩm mốc",1/5
51,Arowana Hotel,Nhân viên lễ tân không hề nở nụ cười với khách! Mặt thì xinh nhưng luôn đóng mặt lạnh! Ko có,1/5
52,Arowana Hotel,"không nóng lạnh, có gián trong phòng",1/5
53,Arowana Hotel,"This place needs maintenance, care and better management. The location is OK. Close to restaurants and shops.. Room smelled moldy. Toilet bowl is completely loose. Inside door handle broke while closing the door.",2/5
54,Arowana Hotel,The room was very moldy| noisy and the window is useless. Hotel is located in a very socially complicated area Nothing,2/5
55,Arowana Hotel,"trên sofa phòng 202 có cả cứt mũi, đèn ngủ hư, phòng nhỏ, khăn tắm vàng dơ, ga giường có mùi nặng, chỉ có 1 đôi dép. Phụ. wifi mạnh. thái độ nhân viên và phòng có mùi thuốc lá nặng",2/5
56,Arowana Hotel,"Phòng hơi nhỏ, thiết bị vệ sinh cũ quá... một số linh kiện đã huế hỏng Có nhiều điểm ăn uống giá cả bình dân",2/5
57,Arowana Hotel,Phòng không sạch sẽ. Nhân viên không nhiệt tình. Khó chịu với khách hàng Địa điểm tốt,2/5
58,Arowana Hotel,Không giống với hình trên booking chia sẻ,2/5
59,Arowana Hotel,The pillow is smelly| the small fridge doesnot work... and there is too much ants!! Will not come back.The sub area is Japanese-street so there are many Japanese restaurants. It is the only good point.,3/5
60,hanoi liberty hotel,"(Translated by Google) Rat la chan do dung nen di
(Original)
Rat la chan do dung nen di",1/5
61,NuSmile Homestay,"Miss Nu was very welcoming and friendly, Nu accomodated our flight requirements, my partner and I felt incredibly safe, and we were very well looked after here, our room was in a really great condition, we had a nice little balcony to sit on. We will miss you and your gorgeous family Nu!!!",5/5
62,NuSmile Homestay,Our stay was really great! The room is cozy and seems like being at home! The family is really nice and definitely would stay here again!!!,5/5
63,NuSmile Homestay,"Nice and clean rooms close to the markets and everything you need. Altough I didnt fall in love Hanoi itself, the stay at this homestay was delightful and is good place to start your journey through Vietnam. You'll be able to purchase local SIM (30d, 2GB per day for 8€) and Bus Tickets here",5/5
64,NuSmile Homestay,"Really amazing stay! so clean, so hospitable and Ms Nu goes above and beyond to ensure you have a comfortable stay. She also is a travel agent and can help you book things on your trip! …",5/5
65,NuSmile Homestay,"We couldn't expect more than what Nu offered to us. The room was clean and fresh, furnished and we'll equipped (AC, fan, essential oil diffuser), the bed linen clean and mattress confortable. …",5/5
66,NuSmile Homestay,"Super cute place in the heart of the Old Quarter in Hanoi. The host was really responsive, helpful, and kind. She helped us join day trips to Ninh Binh and Halong Bay that were both very well organized with a lot of activities and just enough time for everything. Highly recommended!",5/5
67,NuSmile Homestay,We felt very welcomed by Nu and her family. W ehad booked another room but once upon arrival we were informed we could sleep in a bigger one for one night without charge because of some booking things. The room was very clean and …,5/5
68,NuSmile Homestay,"Two friends and me spend a couple of nights at Nu's place and it was a great choice, she was very helpful and kind. Plus great location. Totally recommend it 👍",5/5
69,NuSmile Homestay,"Stayed for just one night, would loved to have booked in for longer. Lovely host family with very warm welcome. Very enjoyable.",5/5
70,NuSmile Homestay,"Ms. Nu was very helpful! Cheap prices and she helped with everything. The breakfast is cheap but nothing more than some ramen, jam and bread or an omelet. Right in the old quarter, just a 10 minute walk to Hoan Kiem lake. one thing is that they dont have walk in showers, just a hose in the bathroom",5/5
71,Queen Light Hotel,The receptionist/ owner cancelled our booking at 11:30pm is unacceptable. I dont know how you could expect us to run around the city and look for a place to sleep? I stayed here a few times and I like it as its nice and neat but be careful as you might end up sleeping on the street it is scary!,1/5
72,Queen Light Hotel,"(Translated by Google) Price is not clear, quality is poor, old ks.
(Original) …",1/5
73,Queen Light Hotel,"(Translated by Google) underground customer service
(Original)
unterirdischer Kundenservice",1/5
74,Queen Light Hotel,,1/5
75,Queen Light Hotel,,1/5
76,Queen Light Hotel,,1/5
77,Queen Light Hotel,"(Translated by Google) Hotel very cheap, staff friendly, small room, bathroom dirty view not intoxicating, breakfast Okay …",2/5
78,Queen Light Hotel,"(Translated by Google) Old building. Tasty breakfast.
(Original)
오래된건물. 맛없는조식.",2/5
79,Queen Light Hotel,,2/5
80,Queen Light Hotel,,2/5
81,Golden Time Hostel 3,"Friendly staff, but the place is horrendous to stay. We only lasted one night, and that was because we arrived at midnight! There is no sound proof in the room so you can hear people coming and going all night long. A random window from our …",1/5
82,Golden Time Hostel 3,Unfortunately I can't give this place less than 1 star which it deserves. the staff are friendly but the place is a joke when we got there it took 20 minutes to find the correct room(someone had lost the key the previous week to our room) …,1/5
83,Golden Time Hostel 3,Awful experience.dirty and not confy.DONT GO IN HERE,1/5
84,Golden Time Hostel 3,This place is funny. We got a room with a view to the toilet. Toilet itself stinks and was very dirty. Would never stay there again.,1/5
85,Golden Time Hostel 3,"(Translated by Google) The room is ok, but for some reason, the receptionist will lock the left door outside in the morning. Phone calls are busy. I'm in a hurry to finish my work 🥲 …",1/5
86,Golden Time Hostel 3,"(Translated by Google) We are on the 4th floor. Have the feeling that the beds are sagging. WiFi is terrible, rather ... NO WIFI at all. Fridge does not work. Expected more. …",1/5
87,Golden Time Hostel 3,"(Translated by Google) If I have not met any hotel but booked in advance until check-in, it is said that due to the high price, I want to pay, then I will pay for the reservation. …",1/5
88,Golden Time Hostel 3,"(Translated by Google) TOO DOO TOO TOO TOO !!!
(Original)
QUÁ DƠ QUÁ TỆ QUÁ HÔI!!!",1/5
89,Golden Time Hostel 3,,1/5
90,Golden Time Hostel 3,,1/5
91,Hotel Bel Ami Hanoi,"Good location as it’s closed to the centre, easy to access tourist attractions. The toilet is clean and room is exactly like in the picture.",5/5
92,Hotel Bel Ami Hanoi,"Fantastic service. What a bargain! Bustling area a little out of the old town. More locals, great coffee shops nearby. A nice change from seeing tourists non stop! Extremely attentive staff. Very helpful and caring. Thanks again!",5/5
93,Hotel Bel Ami Hanoi,"We've spent our first 2 nights here in Vietnam in this greate Hotel.
It's really cheap and the rooms are clean and have what you need. But the best on this Hotel is the service, the people here helped us a lot. They do everything …",5/5
94,Hotel Bel Ami Hanoi,"Plus:
Close to markets and old quarter
Bathroom and sleeping room clean and nice …",3/5
95,Hotel Bel Ami Hanoi,Ok,5/5
96,Hotel Bel Ami Hanoi,"The staff was very nice. The breakfast was very kindly served, the room is very clean,",5/5
97,Hotel Bel Ami Hanoi,"It's a given that this place is cheap and clean, but i think that are other hotels that can easily match. It's a little further away from the old quarters centre. The rooms and dining area are different from the photos on the hotel website. …",1/5
98,Hotel Bel Ami Hanoi,"The morning staff are always smiling and open, very attentive service, great breakfast, clean rooms daily, very good",5/5
99,Hotel Bel Ami Hanoi,I don't usually complaint about places. Specially because I work in the same industry. …,1/5
100,Hotel Bel Ami Hanoi,Nice place to stay.,4/5
101,Rising Dragon Estate Hotel,"BAD HOTEL. All round bad hotel. Incompetent staff. We booked 2 rooms but when we arrived the staff tried putting us all into 1 room and made us feel awkward for insisting that we have 2 separate rooms. On top of that, the day before we …",1/5
102,Rising Dragon Estate Hotel,"We were supposed to stayed in this hotel for one night in april.
We choose this particular hotel because we knew that we were supposed to arrive late and the reception was supposed to be open 24/7. …",1/5
103,Rising Dragon Estate Hotel,Housekeeping still from fridge my food....,1/5
104,Rising Dragon Estate Hotel,"(Translated by Google) Very bad hotel. They have rats in the kitchen and the bathrooms are pretty dirty. During the break between the trip from Sapa to Ha Long Bay we had to give us a room, even though the site was that they had rooms free, …",1/5
105,Rising Dragon Estate Hotel,(Translated by Google) Not recommendable. Dirty room and mess with the name of the hotel. For the same price you will find in the area very good hotels. Strange story with Zimmerupgrade (not to be fooled). …,1/5
106,Rising Dragon Estate Hotel,,1/5
107,Rising Dragon Estate Hotel,,1/5
108,Rising Dragon Estate Hotel,"Very cheap but very worrying. The hotel had two names, room and whole building was very old, the staff were very helpful. I will not stay in this hotel in the future. Not suitable for sole travel, the local was in a maze",2/5
109,Rising Dragon Estate Hotel,"The rooms look nothing like the pictures. Everything seems to be falling apart, including our sellotaped floorboards. There was also matresses in the hallway and was really unclean. I booked 2 rooms for 3 nights, and they asked if we could …",2/5
110,Rising Dragon Estate Hotel,"(Translated by Google) The number did not match the stated in the photographs and description on the booking. The room was a category superior.
The location of the hotel is excellent. Comfortable bed. Very polite and helpful …",2/5
111,Golden Wings Hotel,"(Translated by Google) Very good relation cost service
(Original) …",4/5
112,Golden Wings Hotel,,4/5
113,Golden Wings Hotel,,4/5
114,Golden Wings Hotel,This hotel was in a fab location for food and exploring the city. Staff were friendly and rooms clean and as u need them to be,5/5
115,Golden Wings Hotel,Nice room,5/5
116,Golden Wings Hotel,day la mot khach san tot,5/5
117,Golden Wings Hotel,"(Translated by Google) Welcome to 3 star hotel, go to buffet, room, hotel, restaurant staff ... Minh will be back in som nhat time! …",5/5
118,Golden Wings Hotel,(Translated by Google) Rested with friends in the period from 11/19/2012 to 11/21/2012. Very clean hotel and friendly staff. Good breakfast. Very good location. Small cozy rooms. …,5/5
119,Golden Wings Hotel,,5/5
120,Golden Wings Hotel,,5/5
121,Hanoi Rendezvous Hotel,Staff was friendly and kind. But room was very dirty and smelly. Bath towels were not clean and had some stains. Mosquito was flooding the room.,1/5
122,Hanoi Rendezvous Hotel,"I book Hanoi Rendezvous hotel because of convenient location. It is very close to some famous places that we have plan must go. Staff is friendly, helpful and very professional with smiling always. It is same for staff in restaurant for …",5/5
123,Hanoi Rendezvous Hotel,"It is very affordable and convenient as it is strategically located within walking distance to all the eateries and attractions. The room is clean, simple yet has everything you need. The staffs can speak fluent English and they are very helpful too! This hotel is perfect for budget travellers. We had an enjoyable stay.",5/5
124,Hanoi Rendezvous Hotel,"My flight landed after midnight but they sent a driver to pick me up. The hotel serves very good breakfast with multiple choices. When I had questions, I always got informative replies. Every staff is helpful. The lady, Wendy, helped me book a Halong Bay tour and a train ticket to Hue. Special thanks to her!",5/5
125,Hanoi Rendezvous Hotel,Well located position. Staff very friendly and helpful. But the bad fitting door to the balcony ment a lot of noise which started very early. Basic hotel but we paid a basic price so didn't have a problem. Enjoyed my over all.,3/5
126,Hanoi Rendezvous Hotel,"Wonderful, attentive staff who were on hand to help from start to finish. Very helpful when booking trips/excursions. Free breakfast is included and rather generous. Rooms were clean and spacious. Would happily come back again! 🌟",5/5
127,Hanoi Rendezvous Hotel,"Thoroughly enjoyable. Delicious breakfast, large room with all amenities working.
Efficient, friendly , honest staff and location hard to beat. The quiet balcony …",4/5
128,Hanoi Rendezvous Hotel,Decent hotel with nice staff. Also the price is very good for what you get. Although we felt a little pit pushed to book a tour with them.,4/5
129,Hanoi Rendezvous Hotel,"Great hotel, clean and comfortable. The staff is great, very helpful and thoughtful and the breakfast was lovely. Would definitely stay here again!",5/5
130,Hanoi Rendezvous Hotel,"The hotel was up to the mark. On the very first day, we had some issues in our room, like the shower tap was not working or the room was hot etc. However, the staffs are really nice, helpful and well-behaved. They are always present to …",5/5
131,Hanoi Fantasea Hotel,We booked a superior double room on agoda. The room was completely different to the pictures and completely covered in mold. We had the room in the first floor left side. Super noisy. We would never ever stay again. Worst experience in Hanoi.,1/5
132,Hanoi Fantasea Hotel,"Paid in advance for a superior twin, meaning a room with a desk and two individual beds. On arrival the location looked much worse than pictured. We were informed that they only had a room with a single bed, and no desk. …",1/5
133,Hanoi Fantasea Hotel,"(Translated by Google) The room I booked was very damp, in fact it smelled of mold, and under the floor there was an outbreak of ants. …",1/5
134,Hanoi Fantasea Hotel,"(Translated by Google) Horrible. Dirty and very bad service
(Original) …",1/5
135,Hanoi Fantasea Hotel,Clean room. Good airconditioner. No elevator. No room services. Staff and owner are dog eaters and they can be irritated sometimes.,2/5
136,Hanoi Fantasea Hotel,"(Translated by Google) Access is possible until late.
I do not clean it for long stay …",2/5
137,Hanoi Fantasea Hotel,"(Translated by Google) Old town center, near pedestrian street. There is no lift, no parking space. …",2/5
138,Hanoi Fantasea Hotel,"(Translated by Google) A bit seedy and not very clean, cheap
(Original) …",2/5
139,Hanoi Fantasea Hotel,,2/5
140,Hanoi Fantasea Hotel,"Good location, helpfully staff, standard service. They rent motorbike and offer other kind of services. The street is noisy and the windows don't block well the noise, so don't forget your earplugs if you're sensitive to this. Hot water, towel and some toiletries included.",3/5
141,Hanoi City Backpackers Hostel,"We stayed in a single room requesting two single beds which we didn’t give et. No backpacker vibe in this hostel at all. Much better hostel, inns to stay in around Hanoi. Do your research and stay somewhere else!! Overall do yourself a …",1/5
142,Hanoi City Backpackers Hostel,"Terrible, after reading the reviews i was so excited, when we arrived we booked a double bed in a dorm for us , on the photos you see allot of light and a window or a door with a balcony we didn't had any of that we got put in a very small …",1/5
143,Hanoi City Backpackers Hostel,When we arrived the place was kind under construction and the walked us to another one of their brunch a few blocks away! They should advice this to their guests!,1/5
144,Hanoi City Backpackers Hostel,Beware of thieves in this hostel,1/5
145,Hanoi City Backpackers Hostel,"(Translated by Google) Lying and deceiving. Cheap with a reasonable breakfast. For myself I will not return there. I had booked and it was said there is enough space, also correct, but only top beds. So I had to climb up with my old body. …",1/5
